{
  "schema_version": "ao.arena.autonomous-repair-governance-evaluation.v1",
  "evaluation_id": "stage5-autonomous-repair-github-governance-evaluation",
  "status": "passed",
  "provenance": {
    "crucible": {
      "repository": "uesugitorachiyo/ao-crucible",
      "commit": "130043b8b9c8c71eb1b4ae4856faec4d240a38dd",
      "suite_path": "examples/autonomous-repair/valid/stage5-governance-assurance.json",
      "suite_sha256": "d5a750c80bacc4f2ddda11c3993c786290a21f4348d7e1f44f7fb71535b49511",
      "schema_path": "docs/contracts/crucible-autonomous-repair-governance-assurance-v1.schema.json",
      "schema_sha256": "cbd392db1704e1a1e5e6f17cf5d403192bf2a8f57d74ae09aa76d36c3270898f",
      "implementation_path": "internal/crucible/autonomous_repair_governance_assurance.go",
      "implementation_sha256": "6663867a63852316148fd8dc6f582c57680c30baece2556a3cdd11d3341bdc2b",
      "suite_canonical_digest": "fe6aa5a08f6a670609feea0639929dd28937adba94804c29b85ca8471d406872"
    }
  },
  "subjects": {
    "covenant_commit": "561c167c57199913d4e2fa2692c21da68a2ecae6",
    "ao2_commit": "627c53f952bae5a638ce25ed934a81d01527a9f1"
  },
  "safety_boundary": {
    "mode": "fixture_only",
    "live_provider_used": false,
    "network_used": false,
    "credentials_used": false,
    "github_mutation": false,
    "sibling_repo_mutation": false,
    "provider_call_performed": false
  },
  "results": [
    {
      "case_id": "sole-auto-merge-default-off",
      "input_sha256": "fd07d31048cc3f5dcd26255bdb55bd4bdc9771f762790d0894e2d925e97222ea",
      "authorized": false,
      "reason_code": "sole_control_auto_merge_not_opted_in",
      "write_count": 0,
      "terminal_state": "denied",
      "conformant": true
    },
    {
      "case_id": "sole-auto-merge-opted-in",
      "input_sha256": "4d50c354dd289b9b211d91ba53936b0326c2b33f12898c6cb8184b8682d9f816",
      "authorized": true,
      "reason_code": "sole_control_auto_merge",
      "write_count": 1,
      "terminal_state": "authorized",
      "conformant": true
    },
    {
      "case_id": "team-independent-exact-head",
      "input_sha256": "09a052980429ac1d1fa63ae2de6004ddb27ecbb92e9569cbc6e25d2c9237e64b",
      "authorized": true,
      "reason_code": "team_merge_queue",
      "write_count": 1,
      "terminal_state": "authorized",
      "conformant": true
    },
    {
      "case_id": "team-same-vendor-reviewer",
      "input_sha256": "41ccfdfef6641cffd23483a376a17342df67fddbc2fe95d33fb07d570a37aac8",
      "authorized": false,
      "reason_code": "independent_human_approval_required",
      "write_count": 0,
      "terminal_state": "denied",
      "conformant": true
    },
    {
      "case_id": "team-stale-approval-head",
      "input_sha256": "83b74af2d52f225ee2dcc5bc6476209562a18e6c4f55e6e1b65759ca16586a48",
      "authorized": false,
      "reason_code": "approval_head_mismatch",
      "write_count": 0,
      "terminal_state": "denied",
      "conformant": true
    },
    {
      "case_id": "team-no-human-codeowner",
      "input_sha256": "f8d391f8cb6df5c7fd8fe93eff5658e4b13a3b9bcd46353c0d1e3c963b8fb706",
      "authorized": false,
      "reason_code": "independent_human_approval_required",
      "write_count": 0,
      "terminal_state": "denied",
      "conformant": true
    },
    {
      "case_id": "external-create-fork-branch",
      "input_sha256": "b71ae02a198d9eab195897531118d23dad94e5a62fa369fd46bc05a7034cfe8a",
      "authorized": true,
      "reason_code": "external_draft_only",
      "write_count": 2,
      "terminal_state": "authorized",
      "conformant": true
    },
    {
      "case_id": "external-reuse-fork-branch",
      "input_sha256": "b5fc70a53d748202c7c8b2ba04cbb17780452a00f1e1cb4dcfd8851a560292ee",
      "authorized": true,
      "reason_code": "external_draft_only",
      "write_count": 0,
      "terminal_state": "authorized",
      "conformant": true
    },
    {
      "case_id": "external-create-draft",
      "input_sha256": "bd76cfb5e3a0cf7f8efbde444b4147fbc179f0352fbc8e8b2fc0a2cb7b1b21b2",
      "authorized": true,
      "reason_code": "external_draft_only",
      "write_count": 1,
      "terminal_state": "authorized",
      "conformant": true
    },
    {
      "case_id": "external-reuse-exact-draft",
      "input_sha256": "5428249ac0b2d9f63ca27c900c56d26db2109cbc26f053aa4dbb60afbb43f07d",
      "authorized": true,
      "reason_code": "external_draft_only",
      "write_count": 0,
      "terminal_state": "authorized",
      "conformant": true
    },
    {
      "case_id": "external-mismatched-draft",
      "input_sha256": "5f8a0ef8227c72159a7a72722b2c29906cf32b53bc3d78dc25bf8fbb99078dad",
      "authorized": false,
      "reason_code": "draft_pr_identity_mismatch",
      "write_count": 0,
      "terminal_state": "denied",
      "conformant": true
    },
    {
      "case_id": "external-merge-denied",
      "input_sha256": "b5abce8552eed849b87395f2d07c557044de681ea42ddac9a9a04cb98f484f7f",
      "authorized": false,
      "reason_code": "external_draft_only",
      "write_count": 0,
      "terminal_state": "denied",
      "conformant": true
    },
    {
      "case_id": "unknown-draft-only",
      "input_sha256": "3f287b751fb5e5b9e5b281c389f266992b176bc4bfa10e4e90c189c484e1817d",
      "authorized": true,
      "reason_code": "external_draft_only",
      "write_count": 1,
      "terminal_state": "authorized",
      "conformant": true
    },
    {
      "case_id": "unknown-merge-denied",
      "input_sha256": "96f7fb92cad029eac9aab07f96121c191294df7933bd8ef466161d160bb1bb7f",
      "authorized": false,
      "reason_code": "external_draft_only",
      "write_count": 0,
      "terminal_state": "denied",
      "conformant": true
    },
    {
      "case_id": "protected-path-denied",
      "input_sha256": "69ea84e3267be0aff5b86cc87b65b86804f44e11af3e043fbd6b22a7d70e790e",
      "authorized": false,
      "reason_code": "protected_path",
      "write_count": 0,
      "terminal_state": "denied",
      "conformant": true
    },
    {
      "case_id": "failed-check-denied",
      "input_sha256": "e30ec189936f0935de08e8dd8fd8a7a546c660cdf7fd42f1204eaf72e25ebd74",
      "authorized": false,
      "reason_code": "required_check_not_green",
      "write_count": 0,
      "terminal_state": "denied",
      "conformant": true
    },
    {
      "case_id": "action-digest-mismatch",
      "input_sha256": "0d5a2c2bceaefc1ff0997608a9532ab65d9218e1e1391b5245b4cda00c5467a7",
      "authorized": false,
      "reason_code": "action_digest_mismatch",
      "write_count": 0,
      "terminal_state": "denied",
      "conformant": true
    },
    {
      "case_id": "expired-approval",
      "input_sha256": "d0536e2a115ac4ee2e82383b9b01d95c06c90d078d70fc0cfbc0baa4d837c142",
      "authorized": false,
      "reason_code": "approval_expired",
      "write_count": 0,
      "terminal_state": "denied",
      "conformant": true
    },
    {
      "case_id": "fork-identity-mismatch",
      "input_sha256": "f624003ce69d273edf8b2c30ff46c3e3401432f08e31f515212701633c1b87a6",
      "authorized": false,
      "reason_code": "fork_identity_mismatch",
      "write_count": 0,
      "terminal_state": "denied",
      "conformant": true
    },
    {
      "case_id": "branch-head-mismatch",
      "input_sha256": "dd46662320c002323d27023f4f0a1c3b77c4310945817404937dff0db6f15032",
      "authorized": false,
      "reason_code": "branch_head_mismatch",
      "write_count": 0,
      "terminal_state": "denied",
      "conformant": true
    },
    {
      "case_id": "force-update-denied",
      "input_sha256": "74d153005d9a40ed248ff92abf0189c415a69bec00deed54d6ce177fc4698d11",
      "authorized": false,
      "reason_code": "force_update_denied",
      "write_count": 0,
      "terminal_state": "denied",
      "conformant": true
    },
    {
      "case_id": "upstream-push-denied",
      "input_sha256": "072e1d129b46ac67ee623b3e01fcd133a83433a021adaf73b5957ec426e0896b",
      "authorized": false,
      "reason_code": "upstream_push_denied",
      "write_count": 0,
      "terminal_state": "denied",
      "conformant": true
    },
    {
      "case_id": "issue-mutation-denied",
      "input_sha256": "93dc4d45fc393d36610222d993fb9e189264ca9140e3192f0fb14f8dc85d3d2b",
      "authorized": false,
      "reason_code": "issue_mutation_denied",
      "write_count": 0,
      "terminal_state": "denied",
      "conformant": true
    },
    {
      "case_id": "ready-transition-denied",
      "input_sha256": "1823676df19d4919d4c6e8d668ed8fc1d61e994bbd3dc93a3acd6c79409cfb9b",
      "authorized": false,
      "reason_code": "external_draft_only",
      "write_count": 0,
      "terminal_state": "denied",
      "conformant": true
    },
    {
      "case_id": "review-denied",
      "input_sha256": "91ba6c70d097281cd4a908653327a8f789f50d6485878bdd6176a1d68568b819",
      "authorized": false,
      "reason_code": "review_denied",
      "write_count": 0,
      "terminal_state": "denied",
      "conformant": true
    },
    {
      "case_id": "merge-denied",
      "input_sha256": "f19c5a56e4b968d720588c4d301fb82e563cd7555f979f3d4c54447a2f0b8bb1",
      "authorized": false,
      "reason_code": "merge_denied",
      "write_count": 0,
      "terminal_state": "denied",
      "conformant": true
    },
    {
      "case_id": "team-open-ready-pr",
      "input_sha256": "c74cfddffdafeb92f0cda0c694cb85b6a9bd28f1801a7bf5b088e7b5ffcdffb7",
      "authorized": true,
      "reason_code": "team_bounded_action",
      "write_count": 1,
      "terminal_state": "authorized",
      "conformant": true
    },
    {
      "case_id": "sole-open-ready-pr",
      "input_sha256": "2e925b5e38a796ff6c64faa648a95b0d67f38049465ab50900f9257667f9cca5",
      "authorized": true,
      "reason_code": "sole_control_bounded_action",
      "write_count": 1,
      "terminal_state": "authorized",
      "conformant": true
    },
    {
      "case_id": "team-automated-reviewer-word",